{
  "doc_type": "pipeline",
  "version": "1.0",
  "id": "24cc9881-f83a-4d38-b15b-8bf541e100fb",
  "app_data": {
    "ui_data": {
      "name": "Simple Pipeline Flow Example",
      "description": {
        "default": "A basic example pipeline - just does load/filter/save"
      },
      "class_name": "pipeline-flow-overall"
    },
    "wml_data": {
      "typeId": "stream"
    }
  },
  "primary_pipeline": "simple-pipeline",
  "pipelines": [
    {
      "id": "simple-pipeline",
      "runtime": "scala-spark-2.0.1",
      "app_data": {
        "ui_data": {
          "zoom": 100,
          "comments": []
        }
      },
      "nodes": [
        {
          "id": "entryID1PE",
          "type": "binding",
          "output": {
            "id": "entryPort1PE",
            "schema_ref": "schema1"
          },
          "connection":{
            "ref":"d7c75790-90fc-4883-a5fc-3bb589166a52",
            "project_ref":"0a0a20e8-e8a8-4710-b90a-6df3ff775b04",
            "properties": {
              "schema_name":"GOSALES",
              "table_name":"PRODUCT_NAME_LOOKUP"
            }
          }
        },
        {
          "id": "nodeID2PE",
          "type": "execution_node",
          "op": "org.apache.spark.ml.ibm.transformers.FilterColumns",
          "inputs": [
            {
              "id": "input1NodeID2PE",
              "schema_ref": "schema1",
              "links": [
                {
                  "node_id_ref": "entryID1PE"
                }
              ],
              "app_data": {
                "ui_data": {
                  "label": {
                    "default": "input 1 Node ID2PE"
                  }
                }
              }
            }
          ],
          "outputs": [
            {
              "id": "output1NodeID2PE",
              "schema_ref": "schema2",
              "app_data": {
                "ui_data": {
                  "label": {
                    "default": "output 1 Node ID2PE"
                  }
                }
              }
            }
          ],
          "parameters": {
            "dropColumns": [
              "integer2",
              "double4"
            ]
          },
          "app_data": {
            "ui_data": {
              "label": {
                "default": "Filter"
              },
              "description": {
                "default": "Filter columns"
              },
              "image": "filter-columns.svg",
              "x_pos": 784,
              "y_pos": 202,
              "class_name": "nodes"
            },
            "wml_data": {
              "typeId": "filter-columns"
            }
          }
        },
        {
          "id": "exitID1PE",
          "type": "binding",
          "input": {
            "id": "exitPort1PE",
            "schema_ref": "schema2",
            "link": {
              "node_id_ref": "nodeID2PE"
            },
            "app_data": {
              "ui_data": {
                "label": {
                  "default": "exit Port 1PE"
                }
              }
            }
          },
          "data_asset":{
            "properties":{
              "name": "employee_data.csv"
            }
          }
        }
      ]
    }
  ],
  "schemas": [
    {
      "id": "schema1",
      "fields": [
        {
          "name": "integer2",
          "type": "integer",
          "nullable": false,
          "metadata": {
            "description": "Field integer2 is an integer field",
            "measure": "range",
            "modeling_role": "input",
            "range": {
              "min": -1,
              "max": 400
            }
          }
        },
        {
          "name": "double4",
          "type": "double",
          "nullable": false,
          "metadata": {
            "description": "Field double4 is a double field",
            "measure": "range",
            "modeling_role": "input",
            "range": {
              "min": 0.101,
              "max": 100.211
            }
          }
        },
        {
          "name": "string1",
          "type": "string",
          "nullable": true,
          "metadata": {
            "description": "Field string1 is a string field",
            "measure": "set",
            "modeling_role": "input",
            "max_length": 24,
            "values": [
              "One",
              "Two",
              "Three"
            ]
          }
        }
      ]
    },
    {
      "id": "schema2",
      "fields": [
        {
          "name": "string1",
          "type": "string",
          "nullable": true,
          "metadata": {
            "description": "Field string1 is a string field",
            "measure": "set",
            "modeling_role": "input",
            "max_length": 24,
            "values": [
              "One",
              "Two",
              "Three"
            ]
          }
        }
      ]
    }
  ]
}
